Image URL,Description,Country,Weather,Time of Day,Season,Activity,Mood/Emotion
https://images.pexels.com/photos/33231935/pexels-photo-33231935.jpeg,"The photo captures the iconic quartzite sandstone pillars of Zhangjiajie National Forest Park in Wulingyuan China often called the real life Avatar Mountains It represents mythical and awe inspiring beauty shown in the contrast between the towering rock formations and the vibrant greenery The cloudy atmosphere adds a sense of mystery and adventure making the landscape feel powerful and untouched",China,Cloudy,Afternoon,Summer,Sightseeing,Curiosity
https://images.pexels.com/photos/1029007/pexels-photo-1029007.jpeg,"I chose this place because Amoudi Harbor in Santorini looks so peaceful and beautiful The turquoise water and the dark red cliffs behind the traditional white buildings create a stunning view On a sunny summer afternoon the small boats float quietly and people enjoy meals at the waterfront making the scene feel calm and relaxing",Greece,Sunny,Afternoon,Summer,Relaxing,Happiness
https://images.pexels.com/photos/2424395/pexels-photo-2424395.jpeg,The photo shows Machu Picchu in Peru bathed in warm golden sunlight with terraces and greenery visible a traveler with a backpack and camera stands near grazing llamas capturing the blend of ancient history and peaceful nature making it feel adventurous and nostalgic,Peru,Sunny,Evening,Spring,Exploring,Adventure
https://images.pexels.com/photos/62348/pexels-photo-62348.jpeg,"The photo shows the Taj Mahal in India with soft morning light illuminating its white marble domes and minarets I chose this place because it represents timeless beauty and architectural elegance attracting visitors from around the world",India,Not Clear,Morning,Winter,Sightseeing,Nostalgia
https://images.pexels.com/photos/26926276/pexels-photo-26926276.jpeg,"I chose this image because it perfectly captures the raw majesty of the African wilderness The sight of a massive elephant with incredible tusks casually strolling through the vast savanna with the snow-capped peak of Mount Kilimanjaro in the background is simply breathtaking It evokes a powerful sense of adventure and a deep appreciation for natures grandeur which is exactly why visiting the Serengeti is a dream of mine",Tanzania,Sunny,Afternoon,Summer,Sightseeing,Adventure
https://images.pexels.com/photos/11229691/pexels-photo-11229691.jpeg,"I chose this image because it feels so classic and timeless Theres a certain magic to seeing the Eiffel Tower from across the Seine River on a clear day It reminds me of movie scenes and classic photographs The calm water and the boats give it a peaceful everyday feel yet the tower itself is so grand and iconic",Paris,Sunny,Afternoon,Fall,Sightseeing,Romance
https://images.pexels.com/photos/18848739/pexels-photo-18848739.jpeg,"I chose this image because it shows the Arashiyama Bamboo Forest in Kyoto on a sunlit day with tall green bamboo stalks creating natural corridors while dappled light filters through the leaves a visitor in traditional kimono walks along the path capturing the perfect harmony of cultural tradition and serene nature making it feel both timeless and peacefully immersive",Japan,Sunny,Morning,Summer,Hiking,Curiosity
https://images.pexels.com/photos/3772630/pexels-photo-3772630.jpeg,"I chose this image because it shows the Pyramids of Giza under a vast desert sky with warm light illuminating the ancient stone structures while a group of tourists on camels creates small silhouettes against the monumental backdrop capturing the awe inspiring scale and enduring mystery of human history making it feel both monumental and deeply timeless",Egypt,Cloudy,Afternoon,Not Clear,Sightseeing,Adventure
https://images.pexels.com/photos/15975880/pexels-photo-15975880.jpeg,"The photo captures the iconic quartzite sandstone pillars of Zhangjiajie National Forest Park in Wulingyuan China often called the real life Avatar Mountains It represents mythical and awe inspiring beauty shown in the contrast between the towering rock formations and the vibrant greenery The cloudy atmosphere adds a sense of mystery and adventure making the landscape feel powerful and untouched",Iceland,Cloudy,Afternoon,Winter,Sightseeing,Adventure
https://images.pexels.com/photos/31398491/pexels-photo-31398491.jpeg,"I chose this image because it captures one of the worlds most famous landmarks the Christ the Redeemer statue in Rio de Janeiro The majestic statue stands with its arms open atop Corcovado Mountain symbolizing hope and peace The photo captures a moment of a tourist visiting standing on the walkway which highlights the statues immense scale and the beauty of the surrounding view under a clear blue sky",Brazil,Sunny,Afternoon,Summer,Sightseeing,Adventure