Image URL,Description,Country,Weather,Time of Day,Season,Activity,Mood/Emotion
https://encrypted-tbn0.gstatic.com/images?q=tbn:ANd9GcTrTRLFwTZCgsBNh0sLGc_QOPTywWmvU7j8jA&s,"This image shows the famous cliffside village of Oia in Santorini, with its iconic white buildings and blue domes overlooking the sea during sunset. I chose this place because it is known worldwide for its breathtaking views, romantic atmosphere, and stunning architecture.",Greece,Sunny,Evening,Summer,Sightseeing,Romance
https://boutiquejapan.com/wp-content/uploads/2019/07/yasaka-pagoda-higashiyama-kyoto-japan.jpg,"This image shows the traditional streets of Higashiyama in Kyoto, with the iconic Yasaka Pagoda in the background. Two women dressed in colorful kimonos stand in the foreground, capturing the essence of Japanese culture. I chose this place because Kyoto represents the heart of JapanŐs heritage, blending peaceful streets, wooden houses, and ancient temples.",Japan,Clear,Evening,Fall,Sightseeing,Nostalgia
https://cdn.britannica.com/61/93061-050-99147DCE/Statue-of-Liberty-Island-New-York-Bay.jpg,"This image shows the Statue of Liberty standing proudly on Liberty Island, with the Manhattan skyline in the background. This place is iconic because it represents freedom, diversity, and the energy of New York City. I chose it because it is one of the most recognizable landmarks in the world.",USA,Sunny,Afternoon,Spring,Sightseeing,Excitement
https://cdn.britannica.com/37/135437-050-A12461CC/Burj-Khalifa-world-Sheikh-Khalifah-ibn-Zayid-2010.jpg,"This image shows the Burj Khalifa, the tallest building in the world, rising above the modern skyline of Dubai. The clear blue sky and the turquoise Dubai Fountain Lake create a stunning contrast. I chose this place because Dubai represents futuristic architecture, luxury, and rapid development.",UAE,Sunny,Afternoon,Summer,Sightseeing,Excitement
https://i.natgeofe.com/k/c41b4f59-181c-4747-ad20-ef69987c8d59/eiffel-tower-night.jpg?wp=1&w=1084.125&h=1627.5,"This image shows the Eiffel Tower beautifully illuminated against the night sky, overlooking the Seine River and the Paris city lights. The warm golden lighting creates a magical and romantic atmosphere. I chose this place because the Eiffel Tower is one of the most iconic landmarks in the world and a symbol of love and elegance.",France,Not Clear,Evening,Not Clear,Sightseeing,Romance
https://www.franceguide.info/wp-content/uploads/sites/18/paris-louvre-pyramid-hd.jpg,"This image shows the famous Louvre Pyramid in the courtyard of the Louvre Museum in Paris. The glass pyramid reflects the sky while surrounded by the historic architecture of the museum. Visitors can be seen walking around, enjoying the artistic and cultural atmosphere. I chose this place because the Louvre is one of the most important museums in the world and represents art, history, and culture.",France,Sunny,Afternoon,Spring,Sightseeing,Curiosity
https://encrypted-tbn0.gstatic.com/images?q=tbn:ANd9GcSEoqNDgdLiRMAeBUdbsF_iyNIpWhK-u6uGGQ&s,"This image shows the iconic Handara Gate in Bali, a traditional Balinese split gate surrounded by lush green mountains and misty clouds. The dramatic scenery and cultural architecture make this one of the most photographed spots in Bali. I chose this place because it represents the natural beauty and spiritual atmosphere of Indonesia.",Indonesia,Cloudy,Morning,Summer,Sightseeing,Curiosity
https://www.iwanderlista.com/wp-content/uploads/2020/09/Venice-Italy-67-1-1024x683.jpg.webp,"This image shows a classic view of VeniceŐs Grand Canal, lined with beautiful historic buildings and crossed by small boats. The warm sunlight reflects off the water, creating a peaceful and picturesque scene. I chose this place because Venice is one of the most unique cities in the world, famous for its canals, architecture, and romantic atmosphere.",Italy,Sunny,Afternoon,Summer,Sightseeing,Romance
https://thenextcrossing.com/wp-content/uploads/2014/04/jordan_petra_the_monastery_1210-HDR-Pano-compressed.jpg,"This image shows the Monastery (Ad-Deir), one of the most magnificent and iconic structures in Petra. The monument is carved directly into the rose-red sandstone cliffs, surrounded by rugged desert landscapes. I chose this place because Petra is a UNESCO World Heritage Site and one of the most fascinating archaeological wonders in the world.",Jordan,Sunny,Afternoon,Summer,Sightseeing,Adventure
https://encrypted-tbn0.gstatic.com/images?q=tbn:ANd9GcR3K-xmmqSBNtm-BaP-BXB3jXFGG624sR-sVQ&s,"This image shows the famous Leaning Tower of Pisa beside the Pisa Cathedral, with a snowy layer covering the ground Ń a rare and beautiful sight for this region. People are walking through the square, enjoying the unique winter scenery. I chose this place because the Leaning Tower is one of the most recognizable landmarks in Italy and a symbol of architectural uniqueness.",Italy,Snowy,Afternoon,Winter,Sightseeing,Curiosity