Image URL,Description,Country,Weather,Time of Day,Season,Activity,Mood/Emotion
https://images.unsplash.com/photo-1502602898657-3e91760cbb34,The iconic Eiffel Tower standing tall against a clear Parisian sky. This landmark represents the romance and beauty of France and has been a dream destination for experiencing European culture and architecture.,France,Cloudy,Afternoon,Summer,Sightseeing,Romance
https://images.unsplash.com/photo-1506905925346-21bda4d32df4,Majestic snow-capped mountains reflecting in a pristine alpine lake. The serene beauty of the Swiss Alps offers breathtaking landscapes perfect for both adventure and peaceful contemplation.,Switzerland,Cloudy,Morning,Winter,Relaxing,Adventure
https://images.unsplash.com/photo-1528164344705-47542687000d,The vibrant Fushimi Inari Shrine with thousands of red torii gates creating a mesmerizing pathway. This spiritual site in Kyoto represents Japan's rich cultural heritage and offers a unique peaceful experience.,Japan,Cloudy,Afternoon,Fall,Sightseeing,Curiosity
https://images.unsplash.com/photo-1551582045-6ec9c11d8697,A magical winter wonderland in Lapland with snow-covered pine trees and reindeer pulling sleds. This Arctic destination offers a chance to experience traditional Sami culture and witness the beauty of a true winter paradise.,Finland,Snowy,Evening,Winter,Relaxing,Happiness
https://images.unsplash.com/photo-1523482580672-f109ba8cb9be,A night view of the Sydney Opera House with city lights reflecting on the calm water creating a beautiful modern scene,Australia,Not Clear,Evening,Summer,Sightseeing,Excitement
https://images.unsplash.com/photo-1572252009286-268acec5ca0a,A view of historic Islamic architecture in Cairo showing old mosques and the wide city skyline creating a rich cultural scene,Egypt,Sunny,Afternoon,Summer,Sightseeing,Curiosity
https://images.unsplash.com/photo-1546412414-e1885259563a,A clear view of the Burj Al Arab rising beside the calm sea showing modern design and a beautiful coastal scene,United Arab Emirates,Sunny,Afternoon,Summer,Sightseeing,Excitement
https://images.unsplash.com/photo-1524492412937-b28074a5d7da,A peaceful view of the Taj Mahal in the early morning light showing its white marble and clear reflection in the long pool creating a calm and beautiful scene.,India,Not Clear,Morning,Spring,Sightseeing,Nostalgia
https://images.unsplash.com/photo-1516026672322-bc52d61a55d5,A peaceful sunset over the Serengeti savanna in Tanzania with an iconic acacia tree standing alone in the golden landscape. The warm colors and wide open plains create a calm and breathtaking scene.,Tanzania,Sunny,Afternoon,Fall,Relaxing,Adventure
https://images.unsplash.com/photo-1552465011-b4e21bf6e79a,The stunning tropical beaches and limestone cliffs of Thailand with crystal-clear turquoise waters. This paradise destination offers white sandy beaches perfect for relaxation and water activities in Southeast Asia.,Thailand,Sunny,Afternoon,Summer,Relaxing,Happiness 
