Image URL,Description,Country,Weather,Time of Day,Season,Activity,Mood/Emotion,
https://c.regencyholidays.com/packages/77f55d8b-6984-429b-a6ab-66dc1c4649ee/original/46e72886-8382-4749-97e0-4eb432ff8a2f.webp,"A peaceful evening view of Mecca, capturing the spiritual atmosphere of the holy city. I chose this place because it represents faith, unity, and it gave me a lifetime pilgrimage experience visit.",Mecca,Not Clear,Evening,Not Clear,Praying,Happiness,
https://a.travel-assets.com/findyours-php/viewfinder/images/res70/471000/471674-Miami.jpg,"This image shows the colorful coastline of Miami, a place I have already visited and really enjoyed. I chose it because of Miamiĺs beaches, vibrant atmosphere , and warm weather.",Miami,Cloudy,Evening,Summer,Boarding,Excitement,
https://a.travel-assets.com/findyours-php/viewfinder/images/res70/292000/292113-Jerusalem-And-Vicinity.jpg,"This image captures the historic and spiritual beauty of Jerusalem. I included it in my list because I have visited the city, and experiencing its ancient landmarks left a deep impression on me.",Jerusalem,Sunny,Evening,Summer,Sightseeing,Nostalgia,
https://sahsaraycavesuites.com/wp-content/uploads/2023/03/sini3.jpg,The hot air balloons over Cappadocia are a sight Iĺve always wanted to experience. The unique landscape and peaceful sunrise make it a dream destination,Turkey,Sunny,Afternoon,Spring,Hot Air Ballooning,Adventure,
https://cdn.sortiraparis.com/images/80/83517/636760-visuel-paris-tour-eiffel-cerisiers-en-fleurs.jpg,This image shows a bright spring morning in Paris with flowers blooming and the Eiffel Tower in view. I chose this place because I would love to visit Paris in the spring .,Paris,Sunny,Morning,Spring,Sightseeing,Happiness,
https://assets3.thrillist.com/v1/image/3185166/1584x1056/crop;webp=auto;jpeg_quality=60;progressive.jpg,"This image shows a calm New York City morning, with buildings rising above the streets and the city slowly coming to life , I chose this destination because New Yorkĺs night view inspires me , the glowing skyscrapers, bright lights, and energy of the city at night always make me want to visit.",New York,Cloudy,Morning,Fall,Sightseeing,Excitement,
https://www.mercuryestate.com/assets/images/countries/1600x800/70d6dc9bdf08c4243731383198f9748c.jpeg,"A peaceful small-boat tour gliding through the canals of Italy, surrounded by historic architecture and calm waters. I hope to visit this place one day to enjoy its cultural charm.",Italy,Sunny,Morning,Summer,Rowing,Romance,
https://cdn.scoopempire.com/wp-content/uploads/2016/02/12729361_228111774196885_2176925728741867669_n.jpg,"A traditional souk in old Syria filled with narrow lanes, local shops, and historic architecture. I chose this place because I admire the cultural beauty and the feeling of walking through ancient markets.",Syria,Not Clear,Afternoon,Not Clear,Traditional Shopping,Melancholy,
https://tracks-trails.com/wp-content/uploads/2025/04/TracksTrails-How-Many-National-Parks-in-California-Yosemite-Valley-e1743701347122-1536x942.jpg,"A breathtaking view of one of Californiaĺs iconic national parks, surrounded by towering cliffs, lush forests, and dramatic natural landscapes. I chose this destination because Californiaĺs parks like Yosemite, Sequoia, or Redwood are world famous for their beauty, and I dream of exploring the trails, wildlife, and peaceful nature they offer. It represents adventure and a deep appreciation for the outdoors.",California,Cloudy,Morning,Fall,Hiking,Adventure,
https://entiretravel.imgix.net/getmedia/22c335e1-f6ff-41f0-8972-15c8d9b711ad/Spain-842x469.jpg,"The BasÝlica de la Sagrada FamÝlia in Barcelona, one of the worldĺs most famous architectural masterpieces. I chose this destination because its unique design and long history of construction make it a fascinating cultural icon.",Spain,Cloudy,Afternoon,Spring,Sightseeing,Curiosity,
